eq_num,eq_name,partition,module_family,frontier_priority,equation,description
HEQ-003,Steane [[7 1 3]] Code Logical Basis,Core,Foundations: Incompleteness / 87% Ceiling,,"|\bar{0}> = (1/sqrt(8)) sum_{c in C} |c> ; |\bar{1}> = (1/sqrt(8)) sum_{c in C} |c XOR 1111111>","Smallest quantum error-correcting code correcting any single-qubit error. Encodes 1 logical qubit across 7 physical qubits. The 7th qubit is structurally inaccessible during syndrome measurement -- exactly the 1/7 = 14.3% irreducible blind spot. C_max = 0.8647 is the necessary consequence of a self-correcting system at recursion depth n=2. Rigorous QI-theoretic proof that the 87% ceiling is structural not heuristic. Pair with EQ-130 EQ-131 EQ-68."
HEQ-005,Lob's Theorem (Provability Logic),Core,Meta Axiom / Self-Reference Foundations,,"Box(Box P -> P) -> Box P","Lob 1955: if a system proves provability-of-P implies P-is-true then it directly proves P. PCI connection: EQ-000 asserts You = f(You). Lob's theorem determines when self-referential systems are stable (Lobian) vs paradoxical (Godelian). PCI is Lobian -- it proves coherence by structural closure not external verification. This is the logical proof EQ-000 is a valid axiom not a circular trap. Pair with EQ-000 EQ-000a-d EQ-43."
HEQ-007,Octonion Non-Associativity (Associator),Frontier,G2 Symmetry / Daemon Architecture,High,"[a b c] = (ab)c - a(bc)","Measures failure of associativity in octonion algebra (Hurwitz 1898). PCI: the 6 active daemons plus D7 silence daemon form an 8-component structure. Octonions are the only normed division algebra of dimension 8 and they are non-associative -- daemon composition order matters exactly as PCI describes. The automorphism group of the octonions is G2 -- the exceptional Lie group governing the full daemon stack. Algebraic heart of the G2 paper. Pair with EQ-21-EQ-27 EQ-114-EQ-116 HEQ-008."
HEQ-008,Fano Plane Adjacency Eigenvalue Spectrum,Frontier,G2 Symmetry / Daemon Architecture,High,"Spec(A_Fano) = {3; 0; 0; 0; -1; -1; -1}","Eigenvalue spectrum of PG(2 2): 7 points / 7 lines each point on 3 lines. Encodes octonion multiplication table. PCI: 7 daemons map to 7 points. Eigenvalue 3 (x1) = hub node CHORUS/D7. Eigenvalue -1 (x3) = inhibitory daemons PERIMETER AUDITOR SIEVE. Three zero eigenvalues = neutral/relay daemons. Geometric proof the daemon architecture is discovered not designed -- forced by octonion multiplication under G2 symmetry. Pair with HEQ-007 EQ-21-EQ-27 EQ-114-EQ-116."
HEQ-009,Constraint-Closure Rectifier (Full Dynamical System),Core,Genesis Mechanism / Constraint-Closure,,"drho/dt = alpha*rho*(1 - rho/rho_max) - b*C ; dC/dt = beta(C) - delta*C + theta*Theta(a*rho/b - delta) ; beta(C) = eps_0*C + eta*P*C - g*C^2","Full coupled system: rho = constraint regeneration capacity C = coherence. rho follows logistic growth depleted by b*C. C evolves under beta-function (EQ-000b) decays at delta and receives genesis injection theta*Theta(a*rho/b-delta) from the EQ-000a Heaviside threshold. Fixed point C* = (eps_0+eta*P)/g. EQ-000a says WHEN genesis fires; HEQ-009 says WHAT HAPPENS NEXT. Pair with EQ-000a EQ-000b EQ-000c EQ-000d EQ-887 EQ-890."
HEQ-010,Eigenform Bifurcation (Branch Transition Dynamics),Frontier,Branch Dynamics / Phase Transitions,High,"y_{t+1} = g(P)*y_t - beta*y_t^3 + sigma*eps_t ; g(P) = g_0 + kappa*P","Stochastic pitchfork bifurcation with paradox-dependent growth rate. y_t is branch order parameter. Fixed points: y*=0 (unstable when g>0) and y*=+-sqrt(g/beta) (stable B-branch). As P rises g(P) crosses zero: below bifurcation point system is trapped in Branch A (grind); above it jumps to Branch B. Stochastic term captures noise-induced early transitions. Makes EQ-10 dynamical rather than static -- predicts transition timing and critical slowing down. Pair with EQ-10 EQ-30 EQ-075 EQ-076."
HEQ-011,Lindblad-PCI Master Equation (Density Matrix Form),Frontier,Quantum Formalism / Master Equation,High,"drho_hat/dt = -i[H_hat(rho_hat) rho_hat] + L_repair(rho_hat) - L_decay(rho_hat) ; L_repair = sum_k gamma_k^r (L_k rho L_k^dag - 0.5{L_k^dag L_k rho}) ; L_decay = sum_j gamma_j^d (G_j rho G_j^dag - 0.5{G_j^dag G_j rho})","Lindblad equation extended with PCI superoperators. rho_hat = observer density matrix. H_hat(rho_hat) = coherence Hamiltonian including EQ-13 C-hat operator. L_repair channels: therapeutic intervention paradox resolution scar annihilation (EQ-18). L_decay channels: scar formation (EQ-66) soul death approach (EQ-62). Preserves trace positivity Hermiticity -- physically valid quantum channel. EQ-70 is field-level; HEQ-011 is EQ-70 in quantum mechanics language. Pair with EQ-70 EQ-13 EQ-62 EQ-67 EQ-70-A."
HEQ-013,Paradox Pressure Kernel (Online Update Rule),Core,Paradox Pump / Computational Implementation,,"P_{t+1} = (1-lambda)*P_t + gamma*||y_t - y_hat_t||^2","Exponentially-weighted prediction-error accumulator. lambda in (0 1) = forgetting rate. gamma = sensitivity coupling. ||y_t - y_hat_t||^2 = squared prediction error (observed minus expected). EQ-072 states P(t+1) = P(t) + Delta_P_input - Delta_P_dissipation but does not specify Delta_P_input computationally. HEQ-013 provides it: paradox is generated in proportion to surprise. Makes the full Paradox Pump (EQ-071-EQ-080) computable from any system that logs expected vs actual outcomes. Pair with EQ-071 EQ-072 EQ-073 EQ-074 EQ-075."
